id,technology,published,updated,title,summary,authors
http://arxiv.org/abs/1410.7550v1,Neurotechnology,2014-10-28T08:37:01Z,2014-10-28T08:37:01Z,Learning deep dynamical models from image pixels,"  Modeling dynamical systems is important in many disciplines, e.g., control,
robotics, or neurotechnology. Commonly the state of these systems is not
directly observed, but only available through noisy and potentially
high-dimensional observations. In these cases, system identification, i.e.,
finding the measurement mapping and the transition mapping (system dynamics) in
latent space can be challenging. For linear system dynamics and measurement
mappings efficient solutions for system identification are available. However,
in practical applications, the linearity assumptions does not hold, requiring
non-linear system identification techniques. If additionally the observations
are high-dimensional (e.g., images), non-linear system identification is
inherently hard. To address the problem of non-linear system identification
from high-dimensional observations, we combine recent advances in deep learning
and system identification. In particular, we jointly learn a low-dimensional
embedding of the observation by means of deep auto-encoders and a predictive
transition model in this low-dimensional space. We demonstrate that our model
enables learning good predictive models of dynamical systems from pixel
information only.
","['Niklas Wahlström', 'Thomas B. Schön', 'Marc Peter Deisenroth']"
http://arxiv.org/abs/1505.03964v1,Neurotechnology,2015-05-15T05:53:45Z,2015-05-15T05:53:45Z,"Algebraic identification of the effective connectivity of constrained
  geometric network models of neural signaling","  Cellular neural circuit and networks consisting of interconnected neurons and
glia are ulti- mately responsible for the information processing associated
with information processing in the brain. While there are major efforts aimed
at mapping the structural and (electro)physiological connectivity of brain
networks, such as the White House BRAIN Initiative aimed at the devel- opment
of neurotechnologies capable of high density neural recordings, theoretical and
compu- tational methods for analyzing and making sense of all this data seem to
be further behind. Here, we propose and provide a summary of an approach for
calculating effective connectivity from experimental observations of neuronal
network activity. The proposed method operates on network-level data, makes use
of all relevant prior knowledge, such as dynamical models of individual cells
in the network and the physical structural connectivity of the network, and is
broadly applicable to large classes of biological and non-biological networks.
","['Marius Buibas', 'Gabriel A. Silva']"
http://arxiv.org/abs/2007.11674v1,Neurotechnology,2020-07-18T18:05:14Z,2020-07-18T18:05:14Z,"Using EEG-based brain connectivity for the study of brain dynamics in
  brain-computer interfaces","  The analysis of brain connectivity aims to understand the emergence of
functional networks into the brain. This information can be used in the process
of electroencephalographic (EEG) signal analysis and classification for a
braincomputer interface (BCI). These systems provide an alternative channel of
communication and control to people with motor impairments. In this article,
four strategies for using the brain connectivity in a BCI environment as a tool
to obtain a deeper understanding of the cerebral mechanisms are proposed, with
the principal aim of developing a scheme oriented to neuro-rehabilitation of
gait in combination with different neurotechnologies and exoskeletons. This
scheme would allow improving current schemes and/or to design new control
strategies, as well as rehabilitation approaches.
",['J. A. Gaxiola-Tirado']
http://arxiv.org/abs/2101.05084v1,Neurotechnology,2020-12-10T15:32:17Z,2020-12-10T15:32:17Z,"This Face Does Not Exist ... But It Might Be Yours! Identity Leakage in
  Generative Models","  Generative adversarial networks (GANs) are able to generate high resolution
photo-realistic images of objects that ""do not exist."" These synthetic images
are rather difficult to detect as fake. However, the manner in which these
generative models are trained hints at a potential for information leakage from
the supplied training data, especially in the context of synthetic faces. This
paper presents experiments suggesting that identity information in face images
can flow from the training corpus into synthetic samples without any
adversarial actions when building or using the existing model. This raises
privacy-related questions, but also stimulates discussions of (a) the face
manifold's characteristics in the feature space and (b) how to create
generative models that do not inadvertently reveal identity information of real
subjects whose images were used for training. We used five different face
matchers (face_recognition, FaceNet, ArcFace, SphereFace and Neurotechnology
MegaMatcher) and the StyleGAN2 synthesis model, and show that this identity
leakage does exist for some, but not all methods. So, can we say that these
synthetically generated faces truly do not exist? Databases of real and
synthetically generated faces are made available with this paper to allow full
replicability of the results discussed in this work.
","['Patrick Tinsley', 'Adam Czajka', 'Patrick Flynn']"
http://arxiv.org/abs/2106.12295v1,Neurotechnology,2021-06-23T10:24:15Z,2021-06-23T10:24:15Z,Quantum Brain Networks: a Perspective,"  We propose Quantum Brain Networks (QBraiNs) as a new interdisciplinary field
integrating knowledge and methods from neurotechnology, artificial
intelligence, and quantum computing. The objective is to develop an enhanced
connectivity between the human brain and quantum computers for a variety of
disruptive applications. We foresee the emergence of hybrid classical-quantum
networks of wetware and hardware nodes, mediated by machine learning techniques
and brain-machine interfaces. QBraiNs will harness and transform in
unprecedented ways arts, science, technologies, and entrepreneurship, in
particular activities related to medicine, Internet of humans, intelligent
devices, sensorial experience, gaming, Internet of things, crypto trading, and
business.
","['E. R. Miranda', 'S. Venkatesh', 'C. Hernani-Morales', 'L. Lamata', 'J. D. Martín-Guerrero', 'E. Solano']"
http://arxiv.org/abs/2204.02362v2,Neurotechnology,2022-04-04T12:47:07Z,2022-04-13T12:02:18Z,"Challenges and Opportunities of Edge AI for Next-Generation Implantable
  BMIs","  Neuroscience and neurotechnology are currently being revolutionized by
artificial intelligence (AI) and machine learning. AI is widely used to study
and interpret neural signals (analytical applications), assist people with
disabilities (prosthetic applications), and treat underlying neurological
symptoms (therapeutic applications). In this brief, we will review the emerging
opportunities of on-chip AI for the next-generation implantable brain-machine
interfaces (BMIs), with a focus on state-of-the-art prosthetic BMIs. Major
technological challenges for the effectiveness of AI models will be discussed.
Finally, we will present algorithmic and IC design solutions to enable a new
generation of AI-enhanced and high-channel-count BMIs.
","['MohammadAli Shaeri', 'Arshia Afzal', 'Mahsa Shoaran']"
http://arxiv.org/abs/2302.03752v1,Neurotechnology,2023-02-07T20:57:15Z,2023-02-07T20:57:15Z,"Dynamic Visualization of Gyral and Sulcal Stereoelectroencephalographic
  contacts in Humans","  Stereoelectroencephalography (SEEG) is a neurosurgical method to survey
electrophysiological activity within the brain to treat disorders such as
Epilepsy. In this stereotactic approach, leads are implanted through straight
trajectories to survey both cortical and sub-cortical activity. Visualizing the
recorded locations covering sulcal and gyral activity while staying true to the
cortical architecture is challenging due to the folded, three-dimensional
nature of the human cortex. To overcome this challenge, we developed a novel
visualization concept, allowing investigators to dynamically morph between the
subjects' cortical reconstruction and an inflated cortex representation. This
inflated view, in which gyri and sulci are viewed on a smooth surface, allows
better visualization of electrodes buried within the sulcus while staying true
to the underlying cortical architecture.
","['Markus Adamek', 'Alexander P Rockhill', 'Peter Brunner', 'Dora Hermes']"
http://arxiv.org/abs/2409.11751v1,Neurotechnology,2024-09-18T07:09:59Z,2024-09-18T07:09:59Z,"Accelerated Algorithms for Source Orientation Detection (AORI) and
  Spatiotemporal LCMV (ALCMV) Beamforming in EEG Source Localization","  This paper illustrates the development of two efficient source localization
algorithms for electroencephalography (EEG) data, aimed at enhancing real-time
brain signal reconstruction while addressing the computational challenges of
traditional methods. Accurate EEG source localization is crucial for
applications in cognitive neuroscience, neurorehabilitation, and brain-computer
interfaces (BCIs). To make significant progress toward precise source
orientation detection and improved signal reconstruction, we introduce the
Accelerated Linear Constrained Minimum Variance (ALCMV) beamforming toolbox and
the Accelerated Brain Source Orientation Detection (AORI) toolbox. The ALCMV
algorithm speeds up EEG source reconstruction by utilizing recursive covariance
matrix calculations, while AORI simplifies source orientation detection from
three dimensions to one, reducing computational load by 66% compared to
conventional methods. Using both simulated and real EEG data, we demonstrate
that these algorithms maintain high accuracy, with orientation errors below
0.2% and signal reconstruction accuracy within 2%. These findings suggest that
the proposed toolboxes represent a substantial advancement in the efficiency
and speed of EEG source localization, making them well-suited for real-time
neurotechnological applications.
","['Ava Yektaeian Vaziri', 'Bahador Makkiabadi']"
http://arxiv.org/abs/1211.0886v1,Neurotechnology,2012-11-05T15:13:45Z,2012-11-05T15:13:45Z,Brain Computer Interface Technologies in the Coming Decades,"  As the proliferation of technology dramatically infiltrates all aspects of
modern life, in many ways the world is becoming so dynamic and complex that
technological capabilities are overwhelming human capabilities to optimally
interact with and leverage those technologies. Fortunately, these technological
advancements have also driven an explosion of neuroscience research over the
past several decades, presenting engineers with a remarkable opportunity to
design and develop flexible and adaptive brain-based neurotechnologies that
integrate with and capitalize on human capabilities and limitations to improve
human-system interactions. Major forerunners of this conception are
brain-computer interfaces (BCIs), which to this point have been largely focused
on improving the quality of life for particular clinical populations and
include, for example, applications for advanced communications with paralyzed
or locked in patients as well as the direct control of prostheses and
wheelchairs. Near-term applications are envisioned that are primarily task
oriented and are targeted to avoid the most difficult obstacles to development.
In the farther term, a holistic approach to BCIs will enable a broad range of
task-oriented and opportunistic applications by leveraging pervasive
technologies and advanced analytical approaches to sense and merge critical
brain, behavioral, task, and environmental information. Communications and
other applications that are envisioned to be broadly impacted by BCIs are
highlighted; however, these represent just a small sample of the potential of
these technologies.
","['Brent J. Lance', 'Scott E. Kerick', 'Anthony J. Ries', 'Kelvin S. Oie', 'Kaleb McDowell']"
http://arxiv.org/abs/1705.02042v2,Neurotechnology,2017-05-04T22:54:54Z,2017-07-13T14:37:34Z,Exponential scaling of neural algorithms - a future beyond Moore's Law?,"  Although the brain has long been considered a potential inspiration for
future computing, Moore's Law - the scaling property that has seen revolutions
in technologies ranging from supercomputers to smart phones - has largely been
driven by advances in materials science. As the ability to miniaturize
transistors is coming to an end, there is increasing attention on new
approaches to computation, including renewed enthusiasm around the potential of
neural computation. This paper describes how recent advances in
neurotechnologies, many of which have been aided by computing's rapid
progression over recent decades, are now reigniting this opportunity to bring
neural computation insights into broader computing applications. As we
understand more about the brain, our ability to motivate new computing
paradigms with continue to progress. These new approaches to computing, which
we are already seeing in techniques such as deep learning and neuromorphic
hardware, will themselves improve our ability to learn about the brain and
accordingly can be projected to give rise to even further insights. This paper
will describe how this positive feedback has the potential to change the
complexion of how computing sciences and neurosciences interact, and suggests
that the next form of exponential scaling in computing may emerge from our
progressive understanding of the brain.
",['James B. Aimone']
id,technology,published,updated,title,summary,authors
http://arxiv.org/abs/2206.06276v1,Reusable launch vehicle,2022-06-13T16:03:35Z,2022-06-13T16:03:35Z,On the reusability of samples in active learning,"  An interesting but not extensively studied question in active learning is
that of sample reusability: to what extent can samples selected for one learner
be reused by another? This paper explains why sample reusability is of
practical interest, why reusability can be a problem, how reusability could be
improved by importance-weighted active learning, and which obstacles to
universal reusability remain. With theoretical arguments and practical
demonstrations, this paper argues that universal reusability is impossible.
Because every active learning strategy must undersample some areas of the
sample space, learners that depend on the samples in those areas will learn
more from a random sample selection. This paper describes several experiments
with importance-weighted active learning that show the impact of the
reusability problem in practice. The experiments confirmed that universal
reusability does not exist, although in some cases -- on some datasets and with
some pairs of classifiers -- there is sample reusability. Finally, this paper
explores the conditions that could guarantee the reusability between two
classifiers.
","['Gijs van Tulder', 'Marco Loog']"
http://arxiv.org/abs/1409.2223v1,Reusable launch vehicle,2014-09-08T07:10:37Z,2014-09-08T07:10:37Z,"Assessment of classification techniques on predicting success or failure
  of Software reusability","  Assessment of classification techniques on predicting success or failure of
Software reusability
","['Nahid Hajizadeh', 'Manijeh Keshtgari', 'Marzieh Ahmadzadeh']"
http://arxiv.org/abs/1205.0289v2,Reusable launch vehicle,2012-05-01T23:47:56Z,2012-05-22T21:53:00Z,On the Power of Reusable Magic States,"  In this paper we study reusable magic states. These states are a special
subset of the standard magic states. Once distilled, reusable magic states can
be used, repeatedly, to apply some unitary U. Given this property, reusable
magic states have the potential to greatly lower qubit and gate overheads in
fault-tolerant quantum computation. While these states are promising, we
provide a strong argument for their limited computational power. Specifically,
we show that if reusable magic states can be used to apply non-Clifford
unitaries, then we can exploit them to efficiently simulate poly-sized quantum
circuits on a classical computer.
",['Jonas T. Anderson']
http://arxiv.org/abs/2304.03377v1,Reusable launch vehicle,2023-04-06T21:13:53Z,2023-04-06T21:13:53Z,"Leveraging Reusability: Improved Competitive Ratio of Greedy for
  Reusable Resources","  We study online weighted bipartite matching of reusable resources where an
adversarial sequence of requests for resources arrive over time. A resource
that is matched is 'used' for a random duration, drawn independently from a
resource-dependent distribution, after which it returns and is able to be
matched again. We study the performance of the greedy policy, which matches
requests to the resource that yields the highest reward. Previously, it was
known that the greedy policy is 1/2 competitive against a clairvoyant benchmark
that knows the request sequence in advance. In this work, we improve this
result by introducing a parameter that quantifies the degree of reusability of
the resources. Specifically, if p represents the smallest probability over the
usage distributions that a matched resource returns in one time step, the
greedy policy achieves a competitive ratio of $1/(2-p)$. Furthermore, when the
usage distributions are geometric, we establish a stronger competitive ratio of
$(1+p)/2$, which we demonstrate to be tight. Both of these results align with
the known results in the two extreme scenarios: p = 0 corresponds to
non-reusable resources, where 1/2 is known to be tight, while p = 1 corresponds
to every resource returning immediately, where greedy is the optimal policy and
hence the competitive ratio is 1. Finally, we show that both results are robust
to approximations of the greedy policy. Our work demonstrates that the
reusability of resources can enhance performance compared to the non-reusable
setting, and that a simple greedy policy suffices when the degree of
reusability is high. Our insights contribute to the understanding of how
resource reusability can influence the performance of online algorithms, and
highlight the potential for improved performance as the degree of reusability
increases.
","['Jackie Baek', 'Shixin Wang']"
http://arxiv.org/abs/1210.8011v1,Reusable launch vehicle,2012-10-30T13:57:19Z,2012-10-30T13:57:19Z,Reusability Framework for Cloud Computing,"  Cloud based development is a challenging task for several software
engineering projects, especially for those which needs development with
reusability. Present time of cloud computing is allowing new professional
models for using the software development. The expected upcoming trend of
computing is assumed to be this cloud computing because of speed of application
deployment, shorter time to market, and lower cost of operation. Until Cloud Co
mputing Reusability Model is considered a fundamental capability, the speed of
developing services is very slow. Th is paper spreads cloud computing with
component based development named Cloud Co mputing Reusability Model (CCR) and
enable reusability in cloud computing. In this paper Cloud Co mputing
Reusability Model has been proposed. The model has been validated by Cloudsim
an d experimental result shows that reusability based cloud computing approach
is effective in minimizing cost and time to market.
","['Sukhpal Singh', 'Rishideep Singh']"
http://arxiv.org/abs/2111.07002v1,Reusable launch vehicle,2021-11-13T00:19:03Z,2021-11-13T00:19:03Z,Refactoring for Reuse: An Empirical Study,"  Refactoring is the de-facto practice to optimize software health. While
several studies propose refactoring strategies to optimize software design
through applying design patterns and removing design defects, little is known
about how developers actually refactor their code to improve its reuse.
Therefore, we extract, from 1,828 open-source projects, a set of refactorings
that were intended to improve the software reusability. We analyze the impact
of reusability refactorings on the state-of-the-art reusability metrics, and we
compare the distribution of reusability refactoring types, with the
distribution of the remaining mainstream refactorings. Overall, we found that
the distribution of refactoring types, applied in the context of reusability,
is different from the distribution of refactoring types in mainstream
development. In the refactorings performed to improve reusability, source files
are subject to more design-level types of refactorings. Reusability
refactorings significantly impact, high-level code elements, such as packages,
classes, and methods, while typical refactorings, impact all code elements,
including identifiers, and parameters. These findings provide practical
insights into the current practice of refactoring in the context of code reuse
involving the act of refactoring.
","['Eman Abdullah AlOmar', 'Tianjia Wang', 'Vaibhavi Raut', 'Mohamed Wiem Mkaouer', 'Christian Newman', 'Ali Ouni']"
http://arxiv.org/abs/2309.07291v1,Reusable launch vehicle,2023-09-13T20:17:43Z,2023-09-13T20:17:43Z,Reusability Challenges of Scientific Workflows: A Case Study for Galaxy,"  Scientific workflow has become essential in software engineering because it
provides a structured approach to designing, executing, and analyzing
scientific experiments. Software developers and researchers have developed
hundreds of scientific workflow management systems so scientists in various
domains can benefit from them by automating repetitive tasks, enhancing
collaboration, and ensuring the reproducibility of their results. However, even
for expert users, workflow creation is a complex task due to the dramatic
growth of tools and data heterogeneity. Thus, scientists attempt to reuse
existing workflows shared in workflow repositories. Unfortunately, several
challenges prevent scientists from reusing those workflows. In this study, we
thus first attempted to identify those reusability challenges. We also offered
an action list and evidence-based guidelines to promote the reusability of
scientific workflows. Our intensive manual investigation examined the
reusability of existing workflows and exposed several challenges. The
challenges preventing reusability include tool upgrading, tool support
unavailability, design flaws, incomplete workflows, failure to load a workflow,
etc. Such challenges and our action list offered guidelines to future workflow
composers to create better workflows with enhanced reusability. In the future,
we plan to develop a recommender system using reusable workflows that can
assist scientists in creating effective and error-free workflows.
","['Khairul Alam', 'Banani Roy', 'Alexander Serebrenik']"
http://arxiv.org/abs/2405.04021v1,Reusable launch vehicle,2024-05-07T05:48:02Z,2024-05-07T05:48:02Z,"Robust and Reusable Fuzzy Extractors for Low-entropy Rate Randomness
  Sources","  Fuzzy extractors (FE) are cryptographic primitives that extract reliable
cryptographic key from noisy real world random sources such as biometric
sources. The FE generation algorithm takes a source sample, extracts a key and
generates some helper data that will be used by the reproduction algorithm to
recover the key. Reusability of FE guarantees that security holds when FE is
used multiple times with the same source, and robustness of FE requires
tampering with the helper data be detectable.
  In this paper, we consider information theoretic FEs, define a strong notion
of reusability, and propose strongly robust and reusable FEs (srrFE) that
provides the strongest combined notion of reusability and robustness for FEs.
We give two constructions, one for reusable FEs and one for srrFE with
information theoretic (IT) security for structured sources. The constructions
are for structured sources and use sample-then-lock approach. We discuss each
construction and show their unique properties in relation to existing work.
  Construction 2 is the first robust and reusable FE with IT-security without
assuming random oracle. The robustness is achieved by using an IT-secure MAC
with security against key-shift attack, which can be of independent interest.
","['Somnath Panja', 'Shaoquan Jiang', 'Reihaneh Safavi-Naini']"
http://arxiv.org/abs/1903.04165v2,Reusable launch vehicle,2019-03-11T08:18:32Z,2019-03-16T09:16:07Z,"Object-oriented requirements: reusable, understandable, verifiable","  Insufficient requirements reusability, understandability and verifiability
jeopardize software projects. Empirical studies show little success in
improving these qualities separately. Applying object-oriented thinking to
requirements leads to their unified treatment. An online library of reusable
requirement templates implements recurring requirement structures, offering a
starting point for practicing the unified approach.
",['Alexandr Naumchev']
http://arxiv.org/abs/1007.5123v1,Reusable launch vehicle,2010-07-29T06:53:20Z,2010-07-29T06:53:20Z,"Building Reusable Software Component For Optimization Check in ABAP
  Coding","  Software component reuse is the software engineering practice of developing
new software products from existing components. A reuse library or component
reuse repository organizes stores and manages reusable components. This paper
describes how a reusable component is created, how it reuses the function and
checking if optimized code is being used in building programs and applications.
Finally providing coding guidelines, standards and best practices used for
creating reusable components and guidelines and best practices for making
configurable and easy to use.
","['P. Shireesha', 'S. S. V. N. Sharma']"
